text,label,clean_text,avg_sent_len,num_pronouns,num_nouns,num_verbs
The relative who had a baby recently... um... can't remember who it was.,1,relative baby recently um remember,17.0,3.0,2.0,2.0
I know I turned off the stove but... uh... maybe I should check again.,1,know turn stove uh maybe check,8.5,3.0,1.0,3.0
The show with the detectives solving crimes... um... what's it called?,1,detective solve crime um call,5.0,2.0,3.0,2.0
I was going to write a letter but... uh... who was it for again?,1,go write letter uh,8.5,3.0,1.0,2.0
The thing you use to dry off after a shower... um... towel! It took me a while.,1,thing use dry shower um towel take,10.5,3.0,4.0,3.0
I know I had an important paper but... uh... where did I put it?,1,know important paper uh,8.5,4.0,1.0,3.0
The holiday when we give gifts... um... is it Christmas or Valentine's Day?,1,holiday gift um christmas valentine day,17.0,2.0,3.0,1.0
I was supposed to call someone back but... uh... can't remember who.,1,suppose uh remember,8.0,3.0,0.0,3.0
The place where you borrow books... um... library! Why couldn't I think of that?,1,place borrow book um library think,9.5,3.0,3.0,2.0
I know I scheduled an appointment but... uh... can't recall with whom.,1,know schedule appointment uh recall,8.0,3.0,1.0,3.0
The food I was going to cook for dinner... um... what was the recipe again?,1,food go cook dinner um recipe,9.0,2.0,3.0,2.0
I was going to water the plants but... uh... did I already do that?,1,go water plant uh,8.5,3.0,1.0,3.0
The relative who's coming to visit... um... is it my son or my brother?,1,relative come visit um son brother,18.0,4.0,3.0,2.0
I know I had a question about something but... uh... it's gone now.,1,know question uh go,4.25,4.0,1.0,3.0
The thing you use to cut paper... um... scissors! The word escaped me.,1,thing use cut paper um scissor word escape,8.5,2.0,4.0,3.0
I was supposed to meet someone for lunch but... uh... who was it again?,1,suppose meet lunch uh,8.5,4.0,1.0,2.0
The program about cooking competitions... um... what's that show called?,1,program cooking competition um call,4.666666666666667,1.0,4.0,1.0
I know I put my glasses somewhere but... uh... now I can't find them.,1,know glass uh find,9.0,5.0,1.0,3.0
The street where my doctor's office is... um... can't remember the name.,1,street doctor office um remember,17.0,1.0,4.0,1.0
I was going to take a walk but... uh... did I already go today?,1,go walk uh today,8.5,2.0,2.0,3.0
